{
  "$id": "https://schemas.sswg.local/experiment-scope.json#",
  "$schema": "https://json-schema.org/draft/2020-12/schema",
  "title": "sswg experiment scope",
  "type": "object",
  "additionalProperties": false,
  "required": [
    "anchor",
    "exp_id",
    "exp_version",
    "anchor_family",
    "owner",
    "scope",
    "exit_criteria",
    "graduation_ready"
  ],
  "properties": {
    "anchor": {
      "type": "object",
      "additionalProperties": false,
      "required": ["anchor_id", "anchor_version", "scope", "owner", "status"],
      "properties": {
        "anchor_id": { "type": "string" },
        "anchor_version": { "type": "string" },
        "scope": { "type": "string" },
        "owner": { "type": "string" },
        "status": {
          "type": "string",
          "enum": ["draft", "sandbox", "canonical", "archived"]
        }
      }
    },
    "exp_id": { "type": "string" },
    "exp_version": { "type": "string" },
    "anchor_family": { "type": "string" },
    "owner": { "type": "string" },
    "scope": {
      "type": "array",
      "minItems": 1,
      "items": { "type": "string" }
    },
    "exit_criteria": {
      "type": "array",
      "minItems": 1,
      "items": { "type": "string" }
    },
    "graduation_ready": { "type": "boolean" }
  }
}
